{
  "schemaVersion": 1,
  "definitions": {
    "personas": {
      "schemaVersion": 1,
      "personas": {
        "support": {
          "permissionSets": ["Support_User"],
          "publicGroups": ["Support_Group"],
          "queues": ["Case_Queue"]
        }
      }
    },
    "users": {
      "schemaVersion": 1,
      "users": [{ "userKey": "alice", "userId": "005000000000001AAA", "personas": ["support"] }]
    }
  },
  "orgState": {
    "permissionSets": [{ "id": "0PS000000000001AAA", "name": "Support_User", "label": "Support User" }],
    "permissionSetGroups": [],
    "groups": [
      { "id": "00G000000000001AAA", "developerName": "Support_Group", "label": "Support Group", "type": "Regular" },
      { "id": "00G000000000002AAA", "developerName": "Case_Queue", "label": "Case Queue", "type": "Queue" }
    ],
    "permissionSetAssignments": [],
    "groupMembers": []
  },
  "expectedPlan": [
    {
      "userKey": "alice",
      "userId": "005000000000001AAA",
      "category": "PermissionSet",
      "action": "wouldAssign",
      "status": "planned",
      "detail": "Support User",
      "error": ""
    },
    {
      "userKey": "alice",
      "userId": "005000000000001AAA",
      "category": "PublicGroup",
      "action": "wouldAssign",
      "status": "planned",
      "detail": "Support Group",
      "error": ""
    },
    {
      "userKey": "alice",
      "userId": "005000000000001AAA",
      "category": "Queue",
      "action": "wouldAssign",
      "status": "planned",
      "detail": "Case Queue",
      "error": ""
    }
  ]
}
