{
  "schemaVersion": 1,
  "definitions": {
    "personas": {
      "personas": {
        "support": { "permissionSets": ["Support_User"] },
        "service": { "permissionSetGroups": ["Service_Team"] }
      }
    },
    "users": {
      "users": [
        { "userKey": "alice", "userId": "005000000000006AAA", "personas": ["support"] },
        { "userKey": "bob", "userId": "005000000000007AAA", "personas": ["service"] }
      ]
    }
  },
  "orgState": {
    "permissionSets": [{ "id": "0PS000000000007AAA", "name": "Support_User", "label": "Support User" }],
    "permissionSetGroups": [{ "id": "0PG000000000002AAA", "developerName": "Service_Team", "label": "Service Team" }],
    "groups": [],
    "permissionSetAssignments": [],
    "groupMembers": []
  },
  "expectedPlan": [
    {
      "userKey": "alice",
      "userId": "005000000000006AAA",
      "category": "PermissionSet",
      "action": "wouldAssign",
      "status": "planned",
      "detail": "Support User",
      "error": ""
    },
    {
      "userKey": "bob",
      "userId": "005000000000007AAA",
      "category": "PermissionSetGroup",
      "action": "wouldAssign",
      "status": "planned",
      "detail": "Service Team",
      "error": ""
    }
  ]
}
